{
  "version": "0.4.0",
  "last_updated": "2026-08-10",
  "olive_version_support": {
    "min": "0.12.0",
    "max": "0.13.0"
  },
  "models": [
    {
      "model": "Mistral 7B",
      "frameworks": [
        "PyTorch",
        "ONNX",
        "HuggingFace"
      ],
      "source": "https://github.com/microsoft/Olive/tree/main/examples/mistral",
      "verified": true,
      "notes": "Olive ships a Mistral example; prefer NVModelOpt/AWQ on NVIDIA over plain INT8 QDQ for generation quality.",
      "hardware": {
        "NVIDIA RTX 4090": {
          "OnnxConversion": {
            "support": "supported",
            "olive_pass": "OnnxConversion",
            "note": "Export with dynamic_axes for batch/sequence; use_external_data_format for >2GB weights.",
            "typical_accuracy_drop": "n/a",
            "evidence": {
              "reference": "https://microsoft.github.io/Olive/0.13.0/reference/pass.html",
              "type": "olive_docs",
              "version": "0.13.0"
            }
          },
          "OnnxQuantization": {
            "support": "warning",
            "olive_pass": "OnnxQuantization",
            "note": "INT8 can drop 10-15% perplexity; prefer NVModelOpt AWQ int4.",
            "typical_accuracy_drop": "1-3% with AWQ",
            "evidence": {
              "reference": "https://onnxruntime.ai/docs/performance/model-optimizations/quantization.html",
              "type": "ort_docs",
              "version": "1.19"
            }
          },
          "NVModelOptQuantization": {
            "support": "supported",
            "olive_pass": "NVModelOptQuantization",
            "note": "Best path for NVIDIA; AWQ int4 via TensorRT Model Optimizer.",
            "typical_accuracy_drop": "<2%",
            "evidence": {
              "reference": "https://microsoft.github.io/Olive/0.13.0/reference/pass.html",
              "type": "olive_docs",
              "version": "0.13.0"
            }
          },
          "AutoAWQQuantizer": {
            "support": "supported",
            "olive_pass": "AutoAWQQuantizer",
            "note": "PyTorch-side AWQ before ONNX export; documented Olive LLM quant path.",
            "typical_accuracy_drop": "<2%",
            "evidence": {
              "reference": "https://microsoft.github.io/Olive/0.13.0/reference/options.html",
              "type": "olive_docs",
              "version": "0.13.0"
            }
          },
          "LoRA": {
            "support": "warning",
            "olive_pass": "LoRA",
            "note": "ONNX limitation: re-export base model after adapter merge.",
            "typical_accuracy_drop": "n/a",
            "evidence": {
              "reference": "https://microsoft.github.io/Olive/0.13.0/reference/pass.html",
              "type": "olive_docs",
              "version": "0.13.0"
            }
          },
          "OnnxFloatToFloat16": {
            "support": "supported",
            "olive_pass": "OnnxFloatToFloat16",
            "note": "FP16 halves VRAM; keep I/O float32 if consumers expect FP32.",
            "typical_accuracy_drop": "<1%",
            "evidence": {
              "reference": "https://onnxruntime.ai/docs/performance/model-optimizations/float16.html",
              "type": "ort_docs",
              "version": "1.19"
            }
          }
        },
        "Qualcomm Snapdragon NPU": {
          "OnnxQuantization": {
            "support": "warning",
            "olive_pass": "OnnxQuantization",
            "note": "15GB+ model; needs aggressive pruning or int4 before QNN.",
            "typical_accuracy_drop": "5-10%",
            "evidence": {
              "reference": "https://onnxruntime.ai/docs/execution-providers/QNN-ExecutionProvider.html",
              "type": "ort_docs",
              "version": "1.19"
            }
          },
          "QNNPreprocess": {
            "support": "supported",
            "olive_pass": "QNNPreprocess",
            "note": "Required preprocess for ops not natively on QNN.",
            "typical_accuracy_drop": "n/a",
            "evidence": {
              "reference": "https://microsoft.github.io/Olive/0.13.0/reference/pass.html",
              "type": "olive_docs",
              "version": "0.13.0"
            }
          },
          "QNNQuantization": {
            "support": "supported",
            "olive_pass": "QNNQuantization",
            "note": "Use int4 weights (w4a8) and verify op whitelist.",
            "typical_accuracy_drop": "3-5%",
            "evidence": {
              "reference": "https://microsoft.github.io/Olive/0.13.0/reference/pass.html",
              "type": "olive_docs",
              "version": "0.13.0"
            }
          }
        },
        "Intel Core i9 CPU": {
          "OnnxConversion": {
            "support": "supported",
            "olive_pass": "OnnxConversion",
            "note": "CPU export works; large weights need external data format.",
            "typical_accuracy_drop": "n/a",
            "evidence": {
              "reference": "https://microsoft.github.io/Olive/0.13.0/reference/pass.html",
              "type": "olive_docs",
              "version": "0.13.0"
            }
          },
          "OnnxBlockWiseRtnQuantization": {
            "support": "warning",
            "olive_pass": "OnnxBlockWiseRtnQuantization",
            "note": "RTN int4 is fast for CPU footprint; validate perplexity.",
            "typical_accuracy_drop": "2-4%",
            "evidence": {
              "reference": "https://microsoft.github.io/Olive/0.13.0/reference/options.html",
              "type": "olive_docs",
              "version": "0.13.0"
            }
          },
          "OpenVINOWeightCompression": {
            "support": "supported",
            "olive_pass": "OpenVINOWeightCompression",
            "note": "INT4/INT8 weight compression for low-memory CPU.",
            "typical_accuracy_drop": "2-4%",
            "evidence": {
              "reference": "https://microsoft.github.io/Olive/0.13.0/reference/pass.html",
              "type": "olive_docs",
              "version": "0.13.0"
            }
          }
        }
      }
    },
    {
      "model": "Phi-3-mini",
      "frameworks": [
        "PyTorch",
        "ONNX",
        "HuggingFace"
      ],
      "source": "https://github.com/microsoft/Olive/tree/main/examples/phi2",
      "verified": true,
      "notes": "Phi family is covered by Olive phi examples and NVModelOpt/ORT quant paths; Phi-3-mini is small enough for stable INT8.",
      "hardware": {
        "NVIDIA RTX 4090": {
          "OnnxConversion": {
            "support": "supported",
            "olive_pass": "OnnxConversion",
            "note": "Export with dynamic_axes for batch and sequence.",
            "typical_accuracy_drop": "n/a",
            "evidence": {
              "reference": "https://microsoft.github.io/Olive/0.13.0/reference/pass.html",
              "type": "olive_docs",
              "version": "0.13.0"
            }
          },
          "OnnxQuantization": {
            "support": "supported",
            "olive_pass": "OnnxQuantization",
            "note": "INT8 QDQ works well; TensorRT recommended.",
            "typical_accuracy_drop": "<1%",
            "evidence": {
              "reference": "https://onnxruntime.ai/docs/performance/model-optimizations/quantization.html",
              "type": "ort_docs",
              "version": "1.19"
            }
          },
          "NVModelOptQuantization": {
            "support": "supported",
            "olive_pass": "NVModelOptQuantization",
            "note": "AWQ int4 is stable for Phi-class models in Olive examples.",
            "typical_accuracy_drop": "<1.5%",
            "evidence": {
              "reference": "https://github.com/microsoft/Olive/tree/main/examples/phi2",
              "type": "github",
              "version": "0.13.0"
            }
          },
          "OnnxFloatToFloat16": {
            "support": "supported",
            "olive_pass": "OnnxFloatToFloat16",
            "note": "FP16 is the default GPU path for small Phi models.",
            "typical_accuracy_drop": "<1%",
            "evidence": {
              "reference": "https://onnxruntime.ai/docs/performance/model-optimizations/float16.html",
              "type": "ort_docs",
              "version": "1.19"
            }
          }
        },
        "Intel Core i9 CPU": {
          "OnnxStaticQuantization": {
            "support": "supported",
            "olive_pass": "OnnxStaticQuantization",
            "note": "INT8 static quant with calibration is stable for Phi-3-mini.",
            "typical_accuracy_drop": "<1%",
            "evidence": {
              "reference": "https://microsoft.github.io/Olive/0.13.0/reference/pass.html",
              "type": "olive_docs",
              "version": "0.13.0"
            }
          },
          "OnnxBlockWiseRtnQuantization": {
            "support": "supported",
            "olive_pass": "OnnxBlockWiseRtnQuantization",
            "note": "INT4 block-wise RTN for low-memory CPU (same path as Phi-4 recipe).",
            "typical_accuracy_drop": "1-2%",
            "evidence": {
              "reference": "https://microsoft.github.io/Olive/0.13.0/reference/options.html",
              "type": "olive_docs",
              "version": "0.13.0"
            }
          }
        },
        "NVIDIA TensorRT RTX": {
          "OnnxConversion": {
            "support": "supported",
            "olive_pass": "OnnxConversion",
            "note": "Export for NvTensorRTRTXExecutionProvider via the tensorrt-rtx package, which installs the standalone TensorRT RTX EP-ABI provider library for ONNX Runtime 1.23+ (SM≥7.5 Turing+; not the full nvinfer TensorRT SDK).",
            "typical_accuracy_drop": "n/a",
            "evidence": {
              "reference": "https://microsoft.github.io/Olive/0.13.0/reference/pass.html",
              "type": "olive_docs",